"Authors","Author full names","Author(s) ID","Title","Year","Source title","Volume","Issue","Art. No.","Page start","Page end","Page count","Cited by","DOI","Link","Abstract","Author Keywords","Index Keywords","Document Type","Publication Stage","Open Access","Source","EID"
"Vera D.G.; Di Pietro D.O.; Trofino Falasco C.; Tettamanti G.; Iriarte L.; Harkes M.; Kacoliris F.P.; Berkunsky I.","Vera, David G. (57218629552); Di Pietro, Diego O. (56246581000); Trofino Falasco, Clara (57195732012); Tettamanti, Germán (57218626797); Iriarte, Luciana (58043926900); Harkes, Micaela (58044294500); Kacoliris, Federico P. (21934555500); Berkunsky, Igor (24465041800)","57218629552; 56246581000; 57195732012; 57218626797; 58043926900; 58044294500; 21934555500; 24465041800","Identifying key conservation sites for the reptiles of the Tandilia mountains in Pampas highlands","2023","Journal for Nature Conservation","71","","126321","","","","0","10.1016/j.jnc.2022.126321","https://www.scopus.com/inward/record.uri?eid=2-s2.0-85145742766&doi=10.1016%2fj.jnc.2022.126321&partnerID=40&md5=0beb9edceaa9182ae3e7b5fe52ea2139","Reptile populations are facing a global decline as a consequence of anthropic disturbs. For its conservation, it is necessary to know its geographical distribution and the main factors influencing it. Tandilia Mountains are located in the centre of Buenos Aires province, Argentina. These mountains contain high biodiversity and several endemic species, but the current Natural Protected Areas network covers a low area of ​​0.12 %. In this work, we modelled the geographic distribution of reptiles in the Tandilia Mountains to: a) explore the environmental factors affecting the distribution of reptiles on the highland grasslands of the Tandilia Mountain System and (b) identify the key biodiversity areas. We used ten environmental variables and several sources of records (fieldwork, scientific literature, museum collections, and an online database) to model the distribution of each reptile species. The best sites to propose natural reserves were determined in Zonation software. We determined the representativeness of the current system of Natural Protected Areas in the Tandilia Mountain range by overlapping the sites with the Zonation results. We obtained 20 species distribution models with two general patterns: continuous and patched. In most species, the two most informative variables were growing degree-days below 0 °C and precipitation of the wettest quarter. The current system of Natural Protected Areas of the Tandilia Mountains covers 0.35 % of the conservation priority sites (4341 km2) and therefore is insufficient in protecting reptile biodiversity. © 2022 Elsevier GmbH","Conservation biology; Highland grasslands; Lizards; Niche modelling; Snakes","Argentina; Buenos Aires [Argentina]; Tandilia Range; biodiversity; endemic species; environmental factor; geographical distribution; grassland; lizard; niche; population distribution; snake; species conservation","Article","Final","","Scopus","2-s2.0-85145742766"
"Fang C.; Wang X.; Sun D.; Zhai H.; Zhang D.; Liao G.; Wang C.","Fang, Chen (57946423100); Wang, Xiaogu (7501867040); Sun, Dong (57054542300); Zhai, Hongchang (36660449500); Zhang, Dongsheng (57194606292); Liao, Guanghong (58175130900); Wang, Chunsheng (55684065400)","57946423100; 7501867040; 57054542300; 36660449500; 57194606292; 58175130900; 55684065400","Spatial distribution and seasonal variation of fish larvae in the upper 200 m of the Philippine Sea","2023","Frontiers in Marine Science","10","","1110980","","","","0","10.3389/fmars.2023.1110980","https://www.scopus.com/inward/record.uri?eid=2-s2.0-85151951843&doi=10.3389%2ffmars.2023.1110980&partnerID=40&md5=d8a148012378075557db1fd2c51b876f","The Philippine Sea, owing to its complicated circulation pattern and the presence of numerous seamounts, is considered to be a hotspot for biodiversity and an important fishing ground. However, to date, few studies on ichthyoplankton in the Philippine Sea have been conducted. During the summer, autumn, and winter of 2020–2021, a series of investigations were conducted to study the spatial and temporal structure of fish larvae in the Philippine Sea. A total of 65 samples were collected by vertical hauling from a depth of 200 m to the surface. A total of 882 fish larvae representing 81 distinct taxa, 49 genera, and 23 families were identified. A seasonal pattern was also observed based on the differences in abundance and dominant taxa. The abundance of fish larvae was 11.35 ± 12.46 ind./100 m3 (mean ± sd.) in summer, 5.83 ± 7.03 ind./100 m3 in autumn, and 2.57 ± 2.73 ind./100 m3 in winter. The dominant species were Vinciguerria nimbaria, Encrasicholina punctifer, and Cyclothone sp. in summer, V. nimbaria, and Ceratoscopelus warmingii in autumn, and Diaphus spp., D. garmani, and Sigmops sp. in winter. A significant latitudinal variation in fish larvae assemblages was found via cluster analysis, and two geographic groups were separated by the northern boundary of the North Equatorial Current. In addition, the fish larvae species diversity also showed a significant latitudinal gradient in autumn, which disappeared in summer. Canonical correspondence analysis indicated that the structure of fish larvae assemblages was affected by average temperature, salinity, and net primary productivity in the upper ocean and sea level anomaly. All dominant species were associated with specific niche environments. This study suggests that latitudinal zonation of fish larvae also occurs in the oligotrophic low latitude Pacific Ocean and is enhanced in autumn. These results provide multi-seasonal baseline data of fish larvae assemblage in the upper Philippine Sea, being an important reference for the planning of marine protected areas in the high seas. Copyright © 2023 Fang, Wang, Sun, Zhai, Zhang, Liao and Wang.","fish larvae; ichthyoplankton; pelagic fish; Philippine Sea; seasonal change; spatial distribution","","Article","Final","All Open Access; Gold Open Access","Scopus","2-s2.0-85151951843"
"Paulangan Y.P.; Sutrisno D.; Bengen D.G.; Fahrudin A.; Subarno T.; Affandi Z.","Paulangan, Yunus Pajanjan (57208150157); Sutrisno, Dewayany (55349853100); Bengen, Dietriech Geoffrey (55845650900); Fahrudin, Achmad (56646379400); Subarno, Tarlan (57202286546); Affandi, Zulfikar (57272208100)","57208150157; 55349853100; 55845650900; 56646379400; 57202286546; 57272208100","CONSERVATION ZONATION DESIGN OF CORAL REEF AREAS IN DEPAPRE BAY, PAPUA PROVINCE, INDONESIA","2021","International Journal of Conservation Science","12","3","","1129","1138","9","0","","https://www.scopus.com/inward/record.uri?eid=2-s2.0-85115788943&partnerID=40&md5=b93fd2571d439674184ad4fd8fc88bb7","Marine Protected Areas are one of the efforts to maintain biodiversity resources that are managed by a zoning system. Zoning needs to be done by integrating ecosystem and community approaches. This research was conducted in Depapre Bay, Jayapura Regency, Papua Province, which has high biodiversity and diverse cultural communities. Zoning carried out in this study integrates Tiaitiki area into the zoning system based on the Minister of Fisheries Regulation Number KP. 10 of 2010. Based on the analysis of around 9 541.137 ha of the Depapre Bay area, the Core Zone found was around 371.11 ha (3.89%), Sustainable Fisheries Zone around 7,597.48 ha (79.63%), Utilization Zone around 1,028.56 ha (10.78%), and Other Zones around 543.98 ha (5.70%) consisting of Rehabilitation Zone around 62.41 ha (0.65%) and the Flow Zone and Port Zone around 481.57 ha (5.05%). The allocation of around 50% of the Tiaitiki area to become a Core Zone is quite proportional and as a “no-take zone” area, the application of the “open-closed” system is no longer allowed. © 2021. All Rights Reserved.","Coral Reef Ecosystem; Depapre Bay; Marine Protected Area; Tiaitiki; Zonation","","Article","Final","","Scopus","2-s2.0-85115788943"
"Sink K.J.; Lombard A.T.; Attwood C.G.; Livingstone T.-C.; Grantham H.; Holness S.D.","Sink, Kerry Jennifer (15220827800); Lombard, Amanda Talita (7005345210); Attwood, Colin Graham (6701753844); Livingstone, Tamsyn-Claire (57195495398); Grantham, Hedley (14621461700); Holness, Stephen Dale (55974971400)","15220827800; 7005345210; 6701753844; 57195495398; 14621461700; 55974971400","Integrated systematic planning and adaptive stakeholder process support a 10-fold increase in South Africa's Marine Protected Area estate","2023","Conservation Letters","","","","","","","1","10.1111/conl.12954","https://www.scopus.com/inward/record.uri?eid=2-s2.0-85153380794&doi=10.1111%2fconl.12954&partnerID=40&md5=8018c1940a3803344e91a2dc57c48875","South Africa sought to implement an ecologically representative Marine Protected Area (MPA) network to achieve biodiversity and fisheries management goals with least impact on offshore stakeholders. The result was the declaration of a spatially efficient network representing 131 of 150 marine ecosystem types (87%) in 5.4% of ocean area. We outline the 15-year process from planning to implementation of 20 new MPAs, including contentious areas recognized as important for conservation decades ago. Systematic Conservation Planning (SCP) supported by 532 data layers and an inclusive stakeholder process identified priority areas, reduced conflict and guided complex trade-offs. Multiple scenarios and iterative improvements increased transparency, supported ocean zonation and achieved balanced compromises while maintaining conservation objectives. Key challenges, enabling factors and lessons are shared. We demonstrate that flexible, evidence-based SCP together with adaptive social processes that are alert to opportunities can support implementation of representative MPA networks aligned to ocean economy goals. © 2023 The Authors. Conservation Letters published by Wiley Periodicals LLC.","conservation lessons; conservation planning; integrated ocean management; marine ecosystem representation; Marine Protected Area Network; marine reserve; ocean conservation; ocean economy; offshore protection; stakeholder engagement","","Article","Article in press","All Open Access; Gold Open Access","Scopus","2-s2.0-85153380794"
"Korolyuk A.Yu.; Yamalov S.M.; Lebedeva M.V.; Golovanov Y.A.M.; Dulepova N.A.; Zolotareva N.V.","Korolyuk, A.Yu. (36028493500); Yamalov, S.M. (6508299622); Lebedeva, M.V. (57195558957); Golovanov, Y.A.M. (57191291276); Dulepova, N.A. (56152209800); Zolotareva, N.V. (57088307900)","36028493500; 6508299622; 57195558957; 57191291276; 56152209800; 57088307900","Syntaxonomy of xeropetrophytic vegetation of Southern Urals: alliance Elytrigion pruiniferae all. nov; [СинтаКСоноМия КСеропетрофитной раСтительноСти южного урала: Союз elytrigion pruiniferae all. nov]","2022","Rastitel'nost' Rossii","","43","","88","115","27","0","10.31111/VEGRUS/2022.43.88","https://www.scopus.com/inward/record.uri?eid=2-s2.0-85133056710&doi=10.31111%2fVEGRUS%2f2022.43.88&partnerID=40&md5=500f881cca423683532fb93241a8a441","The dominance of xeropetrophytic plant communities with original species composition along with high phytocenotic diversity is the first to determine the distinctness of the South Ural lowmountain steppe province within the Ural Mountains. As the zonal steppe ecosystems are totally destroyed and transformed, petrophytic cenoses represent the predominant type of natural vegetation. They are of high conservation importance due to preserving unique biodiversity with a large number of rare and endangered species, relics and endemics (Ryabinina, 2003; Yamalov et al., 2019). Stony steppes in the Southern Urals have been studied for more than 100 years. Initiated in the 1980s, the syntaxonomical research covers now only the limited territories, mainly within the protected areas (Unikalnye ..., 2014; Prirodnye ..., 2018). The recent studies are focused on the relationship between the petrophytic vegetation and macroecological gradients in the context of geographical zonation (Zolotareva et al., 2019; Korolyuk et al., 2020). Our study presents the results of the analysis of 265 relevés of petrophytic communities of the steppe zone, carried out by the authors on the territory of the Gaysky, Kuvandyksky, Saraktashsky and Belyaevsky administrative districts of the Orenburg region, as well as the Khaibullinsky district of the Bashkortostan Republic in 2014–2018 (Fig. 1). Six phytocoenons were identified using the TWINSPAN algorithm followed by manual sorting. They represent the main diversity of petrophytic vegetation in the studied region and differ in the groups of species identified by formal criteria (Korolyuk et al., 2016; Zolotareva et al., 2019). We conducted the cluster analysis to compare these with the petrophytic associations of the Urals: 26 associations from the classes FestucoBrometea Br.Bl. et Tx. ex Soó 1947 and Anabasietea cretaceae Golovanov et al. 2021 (Fig. 2, 3). Five communities were assigned to the steppe vegetation, and their position in the syntaxonomical system was determined. Communities 1–3 regarded as typical steppes have similar floristic composition and dominant plants; community 4 is closer to the rich forbbunchgrass steppes; community 5 and the ass. Anthemido trotzkianae–Thymetum guberlinensis have transitional features to desert steppes. We identified the new alliance Elytrigion pruiniferae all. nov. D. s.: Allium tulipifolium, Alyssum turkestanicum, Artemisia salsoloides, Centaurea turgaica, Elytrigia pruinifera, Ferula tatarica, Linaria uralensis, Poa bulbosa s. l., Polycnemum arvense, Spiraea hypericifolia. Holotypus — the association Elytrigietum pruiniferae Lebedeva ass. nov. Alliance represents xeropetrophytic vegetation of the steppe zone of the South Urals. Its area covers the watersheds of the Sakmara, Ural and Ilek rivers. Its communities were also found on the right bank of the Sakmara river (the Guberlya and Kuragan basins), as well as in the lower part of the Bolshoy Ik river basin. The communities occupy convex slopes and tops of ridges with immature gravelly soils. In the southern part of the alliance distribution area, they are confined to slopes of various shapes and exposures, while in the northern part mainly to convex southern slopes or to the top of the ridges. The alliance represents xerophytic part of the order HelictotrichoStipetalia. It replaces the more mesophytic alliance Helictotricho desertori–Orostachyion spinosae on the moisture gradient (Korolyuk, 2017). The alliance includes 3 associations and 1 community type. Ass. Elytrigietum pruiniferae Lebedeva ass. nov. (Table 4), holotypus — rel. 1 (field no. 15086): Orenburg region, Kuvandyk district, 1.5 km southwest of Yalnair village, nearsummit convex part of a rocky slope, 51.28635°N, 57.81782°E, 10.06.2015, author — A. Yu. Korolyuk. D. s.: Alyssum turkestanicum, Centaurea turgaica, Elytrigia pruinifera, Linaria uralensis, Poa bulbosa s. l., Polycnemum arvense, Spiraea hypericifolia, Thymus guberlinensis, Tulipa scythica. The association unites petrophytic steppes in hilly lands and lowmountains of the Saraktash, Kuvandyk and Gaysky districts of Orenburg region and on the Turatka mountain in Khaibullinsky district of Bashkiria. The cenoses are confined to convex slopes and tops of ridges. They are developed on gravelly soils on outcrops of basic and metamorphic rocks, less often on sedimentary rocks. There are 4 variants within the association. Ass. Thymo guberlinensis–Galatelletum villosae Yamalov ass. nov. (Table 5), holotypus — rel. 2 (field no. 16015): Orenburg region, Kuvandyk district, 19 km SW of Zaluzhye village, 51.18268°N, 56.91858°E, author — A. Yu. Korolyuk. D. s.: Astragalus tenuifolius, Ephedra distachya, Galatella villosa, Hedysarum argyrophyllum, Meniocus linifolius, Scorzonera stricta, Stipa lessingiana. The association represents xerophytic stony steppes. They occur in all regions confined mainly to the southern slopes and tops of ridges with fine gravelly soils on sedimentary rocks. There are 4 variants within the association Ass. Stipo zalesskii–Centauretum turgaicae ass. nov. (Table 6, rel. 7–22), holotypus — rel. 10 (field no. 17122): Orenburg region, Gaysky district, east of the Kazachya Guberlya village, slightly convex slope of the ridge in the neartop part, 51.14663°N, 58.03227°E, 06.18.2017, author — A. Yu. Korolyuk. D. s.: Amygdalus nana, Campanula sibirica, Carex pediformis, Cephalaria uralensis, Erysimum canescens, Helictotrichon desertorum, Pulsatilla patens, Stipa pulcherrima, S. zalesskii. The association was described in the southeastern part of the Guberlinsky Uplands (Gaysky District). The communities occupy habitats typical for petrophytic steppes — convex slopes and tops of ridges on outcrops of basic and metamorphic rocks. The associations Elytrigio pruiniferae–Stipetum sareptanae Golovanov ass. nov. and Anthemido trotzkianae–Thymetum guberlinensis Golovanov et al., 2021 were described in the study area as well. Ass. Elytrigio pruiniferae–Stipetum sareptanae ass. nov. (Table 7), holotypus — rel. 10 (field no. GY18043): Orenburg region, Kuvandyk district, 4 km SE Novyi village, Suyunduksai Balka, 51.02067°N, 57.33993°E, author — Ya. M. Golovanov. D. s.: Artemisia lerchiana, Astragalus tenuifolius, Atraphaxis frutescens, Ephedra distachya, Gypsophila rupestris, Hedysarum argyrophyllum, H. razoumovianum, Meniocus linifolius, Sterigmostemum tomentosum. The association is found mainly to the south of the latitudinal section of the Ural River within the Guberlinsky Uplands (Kuvandyk District), as well as of the hilly lands of the South Urals (Saraktashsky District). The communities are confined to slopes of different exposure and steepness on outcrops of sedimentary rocks. The plants of dry and desert steppes, as well as those preferring chalk outcrops, are among the diagnostic species. This brings the association together with desertsteppe communities of the order Agropiretalia Korolyuk et Laktionov 2021, class Artemisietea lerchianae Golub 1994 (Korolyuk, Laktionov, 2021). Nevertheless, the composition and structure of cenoses confirm the assignment of the association to the class FestucoBrometea. There are 4 variants within the association The diversity of xeropetrophytic vegetation of the South Urals is much higher than that described in the article. The involvement of data from the adjacent regions of Kazakhstan will facilitate the further development of its syntaxonomical system. © 2022 Komarov Botanical Institute. All rights reserved.","FestucoBrometea; Southern Urals; steppes; syntaxonomy; xeropetrophytic vegetation","","Article","Final","","Scopus","2-s2.0-85133056710"
"Kaky E.; Gilbert F.","Kaky, Emad (57191250362); Gilbert, Francis (7101783388)","57191250362; 7101783388","Allowing for human socioeconomic impacts in the conservation of plants under climate change","2020","Plant Biosystems","154","3","","295","305","10","12","10.1080/11263504.2019.1610109","https://www.scopus.com/inward/record.uri?eid=2-s2.0-85066603194&doi=10.1080%2f11263504.2019.1610109&partnerID=40&md5=e980883355f908b429bc0970de0f9864","The impact of climate change on conservation planning is affected by the availability of data (especially in data-sparse countries) and socioeconomic impacts. We build models using MaxEnt for Egyptian medicinal plants as a model system, projecting them to different future times under two IPCC 4th assessment emission scenarios (A2a and B2a) assuming unlimited and no dispersal. We compare the effect of two indices of socioeconomic activity [Human Influence Index (HII) and human population density/km2] as cost layers in spatial prioritization for conservation using zonation. We assess the efficacy of Egypt's network of Protected Areas (PAs) by comparing the predicted conservation value inside and outside each PA under the various scenarios. The results show that there are many locations in Egypt (the main cities, agricultural land, coastal areas) that are highly ranked for conservation before human socioeconomic impacts are included. The HII had a stronger impact than using human population density. The PA value excess (inside–outside) varied significantly with the type of cost and dispersal, but not with climate-change scenario or Zonation settings. We conclude that human socioeconomic impacts add new scope and insights for future conservation; and conservation planning without consideration of such impacts cannot be complete. © 2019, © 2019 Societá Botanica Italiana.","conservation planning; Egypt; plants; Socioeconomic impact; species distribution models; Zonation","","Article","Final","","Scopus","2-s2.0-85066603194"
"Balotari-Chiebao F.; Santangeli A.; Piirainen S.; Byholm P.","Balotari-Chiebao, Fabio (57015595700); Santangeli, Andrea (36773559600); Piirainen, Sirke (57191517894); Byholm, Patrik (6507818571)","57015595700; 36773559600; 57191517894; 6507818571","Wind energy expansion and birds: Identifying priority areas for impact avoidance at a national level","2023","Biological Conservation","277","","109851","","","","0","10.1016/j.biocon.2022.109851","https://www.scopus.com/inward/record.uri?eid=2-s2.0-85144321207&doi=10.1016%2fj.biocon.2022.109851&partnerID=40&md5=99b85a392b0130773aeff28af5e1dd30","Wind energy can harm birds through collision mortality, displacement, barrier to movements, and habitat loss or degradation with largely unknown consequences for their populations. Impact avoidance via appropriate site selection is the most effective means for preventing or alleviating damage from wind energy. Appropriate site selection requires a knowledge of landscape priorities. Here, we used a Spatial Conservation Prioritisation software to identify priority areas for bird conservation in relation to onshore wind energy in Finland, providing spatial guidance for impact avoidance at the national level. We showed that high bird priority areas are mainly concentrated in coastal and adjacent areas, thus entailing marked regional differences and responsibilities. Only a fraction of high priority areas (e.g., 15 % of 10 % top priority areas) is under some level of protection, indicating that the network of protected areas should be expanded to safeguard sensitive species. We found that the west coast, in particular, concentrates potential conflicts between birds and wind energy due to the co-occurrence of high priority areas and extensive wind energy development regionally. Thus, focusing conservation action away from areas already extensively targeted by wind energy cannot meet the conservation needs of many sensitive species, some of which occur exclusively or mainly in coastal areas. We recommend that birds be protected by avoiding construction in high priority areas and conducting careful spatial planning in coastal and potentially high conflict areas. Our results can contribute to bird conservation schemes, while addressing the pressing issue of biodiversity protection in the context of energy transition. © 2022","Biodiversity; Human-wildlife conflicts; Renewable energy; Spatial planning; Zonation","Finland; biodiversity; habitat loss; landscape ecology; site selection; spatial planning","Article","Final","All Open Access; Bronze Open Access","Scopus","2-s2.0-85144321207"
