"Authors","Author full names","Author(s) ID","Title","Year","Source title","Volume","Issue","Art. No.","Page start","Page end","Page count","Cited by","DOI","Link","Abstract","Author Keywords","Index Keywords","Document Type","Publication Stage","Open Access","Source","EID"
"Yang L.; Yang L.; Li J.; Zhang C.; Huo Z.; Luan X.","Yang, Lei (57194040496); Yang, Li (57188768773); Li, Jingxin (57201299324); Zhang, Chao (57201302216); Huo, Zhaomin (57201296187); Luan, Xiaofeng (9232631100)","57194040496; 57188768773; 57201299324; 57201302216; 57201296187; 9232631100","Potential distribution and conservation priority areas of five species in Northeast China","2019","Shengtai Xuebao","39","3","","1082","1094","12","4","10.5846/stxb201804130847","https://www.scopus.com/inward/record.uri?eid=2-s2.0-85062847508&doi=10.5846%2fstxb201804130847&partnerID=40&md5=c9ed4401681199b5c00071d24fcefac4","Global climate change has already altered species distribution and diversity. It is significant to study the priority protection area of species to develop dynamic strategies for biodiversity conservation under climate change scenarios. In the current study, we estimated the potential distribution of five species (Asian black bear (Ursus thibetanus), moose (Alces alces), otter (Lutra lutra), sable (Martes zibellina), and black-billed capercaillie (Tetrao parvirostris)) in Northeast China over time using Maxent. We used nine general circulation models (GCMs), and four representative concentration pathways (RCPs) to derive future climate projections over three time periods (2030, 2050, 2070), and then modeled species distributions using these predicted environmental measurements for each time period. Zonation was combined with the results from Maxent to identify priority areas, which were further used to optimize the current nature reserve systems. According to the evaluation results of nine GCMs, appropriate climate models in Northeast China were obtained. Based on the GAP analysis for these conservation priority areas, proposals for priority conservation plans were made. The results showed that climate change in the study area would cause a considerable decline in the total distribution areas of the five species. However, different projections by GCMs may cause uncertainty of the predicted distributions. By comparing the species potential distributions, these four GCMs (CCSM4, NorESM1-M, HadGEM2-AO, and GFDL-CM3) performed well in Northeast China. The mean percentage of species potential range loss increased, as 62. 16% range loss by 2030; -73.93% by 2050; and -78.46% by 2070. Conservation priority areas were mainly distributed in a few national nature reserves in the Changbai, Lesser Khingan, Greater Hinggan, and Wanda mountains. © 2019 Science Press. All Rights Reserved.","General circulation models; Maxent; Species distribution change; Species potential distribution; Zonation","China; Alces alces; Lutra lutra; Martes zibellina; Tetrao parvirostris; Ursus americanus; Ursus thibetanus; biodiversity; bird; climate change; climate prediction; conservation; conservation planning; general circulation model; geographical distribution; mammal; maximum entropy analysis; prioritization; protected area; zonation","Article","Final","","Scopus","2-s2.0-85062847508"
"Gerdes K.; Arbizu P.M.; Schwarz-Schampera U.; Schwentner M.; Kihara T.C.","Gerdes, Klaas (57195533047); Arbizu, Pedro Martínez (6505935773); Schwarz-Schampera, Ulrich (6507410835); Schwentner, Martin (33667822900); Kihara, Terue C. (14019901800)","57195533047; 6505935773; 6507410835; 33667822900; 14019901800","Detailed mapping of hydrothermal vent fauna: A 3d reconstruction approach based on video imagery","2019","Frontiers in Marine Science","6","MAR","96","","","","24","10.3389/fmars.2019.00096","https://www.scopus.com/inward/record.uri?eid=2-s2.0-85065407126&doi=10.3389%2ffmars.2019.00096&partnerID=40&md5=bac2efc31e4d7c397ebcf1a18a620234","Active hydrothermal vent fields are complex, small-scale habitats hosting endemic fauna that changes at scales of centimeters, influenced by topographical variables. In previous studies, it has been shown that the distance to hydrothermal fluids is also a major structuring factor. Imagery analysis based on two dimensional photo stitching revealed insights to the vent field zonation around fluid exits and a basic knowledge of faunal assemblages within hydrothermal vent fields. However, complex three dimensional surfaces could not be adequately replicated in those studies, and the assemblage structure, as well as their relation to abiotic terrain variables, is often only descriptive. In this study we use ROV video imagery of a hydrothermal vent field on the southeastern Indian Ridge in the Indian Ocean. Structure from Motion photogrammetry was applied to build a high resolution 3D reconstruction model of one side of a newly discovered active hydrothermal chimney complex, allowing for the quantification of abundances. Likewise, the reconstruction was used to infer terrain variables at a scale important for megabenthic specimens, which were related to the abundances of the faunal assemblages. Based on the terrain variables, applied random forest model predicted the faunal assemblage distribution with an accuracy of 84.97 %. The most important structuring variables were the distances to diffuse- and black fluid exits, as well as the height of the chimney complex. This novel approach enabled us to classify quantified abundances of megabenthic taxa to distinct faunal assemblages and relate terrain variables to their distribution. The successful prediction of faunal assemblage occurrences further supports the importance of abiotic terrain variables as key structuring factors in hydrothermal systems and offers the possibility to detect suitable areas for Marine Protected areas on larger spatial scales. This technique works for any kind of video imagery, regardless of its initial purpose and can be implemented in marine monitoring and management. © 2019 Gerdes, Martínez Arbizu, Schwarz-Schampera, Schwentner and Kihara.","3D reconstruction; Faunal assemblages; Hydrothermal vents; Random forest; Spatial distribution; Terrain variables","","Article","Final","All Open Access; Gold Open Access; Green Open Access","Scopus","2-s2.0-85065407126"
"Betti F.; Bavestrello G.; Bo M.; Enrichetti F.; Loi A.; Wanderlingh A.; Pérez-Santos I.; Daneri G.","Betti, F. (36622924100); Bavestrello, G. (7006227646); Bo, M. (16063296300); Enrichetti, F. (57193847878); Loi, A. (57196123846); Wanderlingh, A. (57196123800); Pérez-Santos, I. (36613682000); Daneri, G. (6701747302)","36622924100; 7006227646; 16063296300; 57193847878; 57196123846; 57196123800; 36613682000; 6701747302","Benthic biodiversity and ecological gradients in the Seno Magdalena (Puyuhuapi Fjord, Chile)","2017","Estuarine, Coastal and Shelf Science","198","","","269","278","9","18","10.1016/j.ecss.2017.09.018","https://www.scopus.com/inward/record.uri?eid=2-s2.0-85031936114&doi=10.1016%2fj.ecss.2017.09.018&partnerID=40&md5=60aa699136326919c24c039f0025c461","Due to its complex hydrological, geomorphological and climatic features, the Chilean fjords region is considered among the most productive areas of the world. The benthic fauna of this region accounts for more than 1600 species showing marked latitudinal biogeographic differences characterizing this as one of the most important hotspot of biodiversity of cold-temperate environments. Despite numerous studies have been conducted to depict the biological characteristics of the fjords, the present situation is strongly unbalanced towards specific taxa. Hence, this study takes into consideration a community approach, highlighting the distribution of six benthic assemblages thriving on vertical walls along the Seno Magdalena fjord (Aysen region). Underwater pictures were used to characterize the trends in abundance and diversity of the main taxa showing distinct responses to salinity and turbidity. Among the less tolerant taxa to high fresh water inputs there are encrusting algae, mainly found in the most external sites lashed by outer currents, far from the estuarine plume. The bathymetric zonation of the assemblages, instead, is characterized by a dense mussel belt in the first 10 m, within a thick layer of low-salinity, nutrient-enriched waters. Rich assemblages of sponges, brachiopods, gorgonians and scleractinians thrive in deeper, marine, clear waters. The evaluation of the ecological role of benthic species leads both to the definition of potential bioindicator taxa responding to anthropic disturbances and to the promotion of protected areas. © 2017 Elsevier Ltd","Benthos; Chile; Patagonian fjords; Salinity; Turbidity; Zonation","Aisen; Chile; Patagonia; algae; Brachiopoda; Gorgonacea; Scleractinia; abundance estimation; anthropogenic effect; assembly rule; bathymetry; benthic environment; benthic fauna; biodiversity; bioindicator; bivalve; environmental gradient; estuarine environment; fjord; salinity; species diversity; sponge; turbidity","Article","Final","","Scopus","2-s2.0-85031936114"
"Stewart D.R.; Underwood Z.E.; Rahel F.J.; Walters A.W.","Stewart, David R. (50961706800); Underwood, Zachary E. (54888997800); Rahel, Frank J. (7003982018); Walters, Annika W. (26029256300)","50961706800; 54888997800; 7003982018; 26029256300","The effectiveness of surrogate taxa to conserve freshwater biodiversity","2018","Conservation Biology","32","1","","183","194","11","20","10.1111/cobi.12967","https://www.scopus.com/inward/record.uri?eid=2-s2.0-85033781149&doi=10.1111%2fcobi.12967&partnerID=40&md5=7d24410179e0b91123e0f6692b78cdab","Establishing protected areas has long been an effective conservation strategy and is often based on readily surveyed species. The potential of any freshwater taxa to be a surrogate for other aquatic groups has not been explored fully. We compiled occurrence data on 72 species of freshwater fishes, amphibians, mussels, and aquatic reptiles for the Great Plains, Wyoming (U.S.A.). We used hierarchical Bayesian multispecies mixture models and MaxEnt models to describe species’ distributions and the program Zonation to identify areas of conservation priority for each aquatic group. The landscape-scale factors that best characterized aquatic species’ distributions differed among groups. There was low agreement and congruence among taxa-specific conservation priorities (<20%), meaning no surrogate priority areas would include or protect the best habitats of other aquatic taxa. Common, wideranging aquatic species were included in taxa-specific priority areas, but rare freshwater species were not included. Thus, the development of conservation priorities based on a single freshwater aquatic group would not protect all species in the other aquatic groups. © 2017 Society for Conservation Biology","biogeografía; biogeography; conservation planning; diseño de reservas; planeación de la conservación; reserve design; surrogates; sustitutos","Animals; Bayes Theorem; Biodiversity; Conservation of Natural Resources; Ecosystem; Fresh Water; Wyoming; Great Plains; United States; Wyoming; Amphibia; Pisces; Reptilia; fresh water; amphibian; Bayesian analysis; biodiversity; biogeography; bivalve; conservation management; conservation planning; fish; freshwater ecosystem; hierarchical system; maximum entropy analysis; prioritization; protected area; reptile; reserve design; surrogate method; animal; Bayes theorem; biodiversity; ecosystem; environmental protection; Wyoming","Article","Final","","Scopus","2-s2.0-85033781149"
"Idohou R.; Assogbadjo A.E.; Kakaï R.G.; Peterson A.T.","Idohou, Rodrigue (55444236400); Assogbadjo, Achille Ephrem (8978006600); Kakaï, Romain Glèlè (24080472000); Peterson, A. Townsend (55665562300)","55444236400; 8978006600; 24080472000; 55665562300","Spatio-temporal dynamic of suitable areas for species conservation in West Africa: eight economically important wild palms under present and future climates","2017","Agroforestry Systems","91","3","","527","540","13","21","10.1007/s10457-016-9955-6","https://www.scopus.com/inward/record.uri?eid=2-s2.0-84965050406&doi=10.1007%2fs10457-016-9955-6&partnerID=40&md5=6fc40fc33d236cad11617efc4a33efab","Sustainable conservation of tropical resources required understanding of their distribution for effective assessment and definition of conservation priorities. In tropical areas, wild palms are highly valued keystone resources with growing demand for both subsistence uses and commercial trade. Here we focused on eight such species (Borassus aethiopum Mart., Eremospathamacrocarpa (G.Mann & H.Wendl.) H.Wendl., Hyphaene thebaica Mart., Laccosperma opacum (G.Mann & H.Wendl.) Drude, Phoenix reclinata Jacq., Raphia hookeri G.Mann & H.Wendl., Raphia sudanica A. Chev., and Raphia vinifera P.Beauv.). This study tested (i) how those palms distributions may be affected under future climate scenarios, and (ii) if species are effectively conserved currently and under future forecasts for their native distributional areas. Finally, we defined spatial priorities for the species’ conservation. Available bioclimatic and soil data layers were used for the modelling with maximum entropy approaches, and resulting maps were overlaid on the existing protected areas network. Results showed that much of the distribution of the species will remain largely stable, albeit with some expansion and retraction in some species; relationships with protected areas networks suggest that protected portions of species distributions will also remain stable. The areas identified as highest conservation priority differ between models even though the highest-priority areas holding most palm species are located along the coast (from Guinea to Nigeria). Further development of these analyses could aid in forming a more complete picture of the distributions and populations of the species, which in turn could aid in developing effective conservation strategies for this botanically important family. © 2016, Springer Science+Business Media Dordrecht.","Biodiversity; Ecological niche; GIS; Representative concentration pathways; Zonation","West Africa; Borassus aethiopum; Hyphaene thebaica; Laccosperma opacum; Phoenix reclinata; Raphia hookeri; Raphia sudanica; Raphia vinifera; bioclimatology; biodiversity; climate conditions; ecological zonation; evergreen tree; future prospect; GIS; keystone species; niche; prioritization; protected area; spatial distribution; spatiotemporal analysis; species conservation; sustainable development; wild population","Article","Final","","Scopus","2-s2.0-84965050406"
"Grantham T.E.; Fesenmyer K.A.; Peek R.; Holmes E.; Quiñones R.M.; Bell A.; Santos N.; Howard J.K.; Viers J.H.; Moyle P.B.","Grantham, Theodore E. (23994889100); Fesenmyer, Kurt A. (55534340500); Peek, Ryan (56800150700); Holmes, Eric (57146458100); Quiñones, Rebecca M. (8916424900); Bell, Andy (57190296636); Santos, Nick (55948734200); Howard, Jeanette K. (8517773600); Viers, Joshua H. (6603554412); Moyle, Peter B. (7004558768)","23994889100; 55534340500; 56800150700; 57146458100; 8916424900; 57190296636; 55948734200; 8517773600; 6603554412; 7004558768","Missing the Boat on Freshwater Fish Conservation in California","2017","Conservation Letters","10","1","","77","85","8","17","10.1111/conl.12249","https://www.scopus.com/inward/record.uri?eid=2-s2.0-84978971835&doi=10.1111%2fconl.12249&partnerID=40&md5=b7b89c73e5068e3c8385b237b97a97dd","Population growth and increasing water-use pressures threaten California's freshwater ecosystems and have led many native fishes to the brink of extinction. To guide fish conservation efforts, we provide the first systematic prioritization of river catchments and identify those that disproportionately contribute to fish taxonomic diversity. Using high-resolution range maps of exceptional quality, we also assess the representation of fish taxa within the state's protected areas and examine the concordance of high-priority catchments with existing reserves and among distinct taxonomic groups. Although most of the state's native fishes are found within protected areas, only a small proportion of their ranges are represented. Few high-priority catchments occur within protected areas, suggesting that fish conservation will require active management and targeted river restoration outside of reserves. These results provide the foundation for systematic freshwater conservation planning in California and for prioritizing where limited resources are allocated for fish recovery and protection. Copyright and Photocopying: © 2016 The Authors. Conservation Letters published by Wiley Periodicals, Inc.","California; fish diversity; freshwater-protected areas; Systematic conservation planning; Zonation software","","Letter","Final","All Open Access; Gold Open Access","Scopus","2-s2.0-84978971835"
"Coetzer-Hanack K.L.; Witkowski E.T.F.; Erasmus B.F.N.","Coetzer-Hanack, Kaera L. (36348291100); Witkowski, E.T.F. (7005010313); Erasmus, Barend F.N. (7004822392)","36348291100; 7005010313; 7004822392","Thresholds of change in a multi-use conservation landscape of South Africa: Historical land-cover, future transformation and consequences for environmental decision-making","2016","Environmental Conservation","43","3","","253","262","9","11","10.1017/S0376892916000084","https://www.scopus.com/inward/record.uri?eid=2-s2.0-84969670152&doi=10.1017%2fS0376892916000084&partnerID=40&md5=e5a6ddcc41c651574a4af84226b3055a","As multi-use conservation landscapes, biosphere reserves (BRs) exemplify the landscape mosaic approach to environmental decision-making. In this study, time-series remotely-sensed data (1993-2006-2012) were used to monitor vegetation transformation in the Kruger to Canyons Biosphere Reserve (K2C) of South Africa, updating previous land-cover research. We identified changes in spatial extent, rate and intensity of land-cover change and extrapolated observed trends to 2018. The increased rate of change in the recent observation period (2.3 vs. 5.7%) was driven by more intensive gains in impacted vegetation and settlement since 2006 (>210 km2 and >120 km2), with resultant transformation of intact habitat undermining regional connectivity. By 2012, intact vegetation had suffered losses of 6.3% (>350 km2) since 2006 and >14% (>750 km2) since 1993. A further 9.5% loss of intact habitat may represent a critical threshold, establishing K2C above the 50% threshold of landscape transformation, whereafter a rapid decline in landscape resilience is likely. Given the BR's spatial zonation, such a loss across the full extent of K2C is unlikely, at least in the short-term (i.e., by 2018). Yet, based on past trends of transformation in the unprotected transition zone, anticipating such losses in the longer term, is not unfounded (i.e., 2024). © Foundation for Environmental Conservation 2016.","Intensity Analysis; Kruger to Canyons Biosphere Reserve; Man and the Biosphere Programme; natural resource management; protected area; socio-ecological system","Kruger to Canyons Biosphere; Biospherics; Decision making; Ecosystems; Environmental protection; Metadata; Natural resources management; Vegetation; Biosphere reserve; Intensity analysis; Man and the Biosphere Programme; Natural resource management; Protected areas; Socio-ecological systems; connectivity; decision making; land cover; landscape change; natural resource; protected area; remote sensing; research program; resource management; threshold; time series analysis; UNESCO; vegetation dynamics; Conservation","Article","Final","","Scopus","2-s2.0-84969670152"
"Di Pietro D.O.; Cabrera M.R.; Williams J.D.; Kacoliris F.P.; Cajade R.; Alcalde L.","Di Pietro, Diego O. (56246581000); Cabrera, Mario R. (7102308047); Williams, Jorge D. (11540308200); Kacoliris, Federico P. (21934555500); Cajade, Rodrigo (36162933900); Alcalde, Leandro (13604785800)","56246581000; 7102308047; 11540308200; 21934555500; 36162933900; 13604785800","Distributional patterns and conservation planning for a snake assemblage from temperate South America","2018","Journal for Nature Conservation","45","","","79","89","10","4","10.1016/j.jnc.2018.08.004","https://www.scopus.com/inward/record.uri?eid=2-s2.0-85051663629&doi=10.1016%2fj.jnc.2018.08.004&partnerID=40&md5=34a36263d7924e5483f3b2d5045da84d","We analyzed the spatial distribution of a snake assemblage from the Sierras de Ventania mountain range, a rich endemism area in east-central Argentina. We used field-collected and museum specimens combined with high-resolution environmental variables to identify common distributional patterns, estimate the suitable habitat for each species, and develop a conservation proposal related to the Protected Natural Areas (PNAs) system. Distributional models diverged into two opposite patterns: suitable habitats for most species at relatively high altitude in the hills, and suitable habitats for Bothrops ammodytoides and Lygophis anomalus at relatively low altitude in the surrounding hill plain. We assessed two proposals based on different conservation algorithms: the additive benefit function (ABF), which favours hilly environments, prioritizing areas with high specific richness, and the core-area zonation (CAZ), which prioritizes the distribution of all species, further indicating areas with low richness in the surrounding plain. Regardless of the algorithm used, our results indicated that the existing PNAs are not effective in protecting the snake assemblage. Protecting at least 5% of the highest species richness areas (ABF) or 5% of the distribution core areas of all species (CAZ), the existing PNAs only represented 2.2% of these priority areas. Our findings are largely consistent with previous work, highlighting that a widespread area needs to be assigned for conservation purposes. Thus, protection of the snake assemblage should take place both inside and outside the PNAs. © 2018 Elsevier GmbH","Conservation; Protected natural areas; Snake assemblages; Suitable habitat","Argentina; Sierras de Ventania; South America; Bothrops ammodytoides; conservation management; endemism; habitat selection; protected area; snake; spatial distribution; species richness; temperate environment","Article","Final","","Scopus","2-s2.0-85051663629"
"Nakhutsrishvili G.; Zazanashvili N.; Batsatsashvili K.; Montalvo Mancheno C.S.","Nakhutsrishvili, George (6505759993); Zazanashvili, Nugzar (6506580865); Batsatsashvili, Ketevan (36476154700); Montalvo Mancheno, Cristian S. (57160059600)","6505759993; 6506580865; 36476154700; 57160059600","Colchic and Hyrcanian forests of the Caucasus: Similarities, differences and conservation status","2015","Flora Mediterranea","25","","","185","191","6","18","10.7320/FlMedit25SI.185","https://www.scopus.com/inward/record.uri?eid=2-s2.0-84960087842&doi=10.7320%2fFlMedit25SI.185&partnerID=40&md5=18107004dd6f67503b440eddb9df05ee","Along with high degree of vascular plant endemism (more than 25%) the existence of two refugia of the Tertiary flora - Colchic and Hyrcanian - are the most unique features of the Caucasus ecoregion. Likewise, Colchic and Hyrcanian forests are classified as temperate rainforests.There are certain physical-geographical and biological similarities and even more differences between Colchic and Hyrcanian regions, reflected on compositions of flora, types of vegetation zonation, as well as spectrums of vegetation formations. An ""individualities"" of these two unique nature phenomena definethe necessity of their equal and effective conservation. Currently, the Colchic forests are better protected: almost half a million hectares, or 16.5% of Colchic region, is covered by protected areas, but there are still some evident gaps to be filled with regard to improve spatial structure of protected areas system and properly cover the most vulnerable ecosystems. More problematic situation is observed in case of Hyrcanian forests, particularly in Iranian part: lack of high categories of protected areas (IUCN categories I-IV), in terms of both number and territory, is the main obstacle for development of protected areas system in Hyrcanian region.","Caucasus; Colchis; Conservation; Forests; Hyrkan","","Article","Final","All Open Access; Gold Open Access; Green Open Access","Scopus","2-s2.0-84960087842"
