"Authors","Author full names","Author(s) ID","Title","Year","Source title","Volume","Issue","Art. No.","Page start","Page end","Page count","Cited by","DOI","Link","Abstract","Author Keywords","Index Keywords","Document Type","Publication Stage","Open Access","Source","EID"
"Appolloni L.; Sandulli R.; Vetrano G.; Russo G.F.","Appolloni, L. (57193354664); Sandulli, R. (6602473946); Vetrano, G. (55608757900); Russo, G.F. (7202430001)","57193354664; 6602473946; 55608757900; 7202430001","Assessing the effects of habitat patches ensuring propagule supply and different costs inclusion in marine spatial planning through multivariate analyses","2018","Journal of Environmental Management","214","","","45","55","10","19","10.1016/j.jenvman.2018.02.091","https://www.scopus.com/inward/record.uri?eid=2-s2.0-85042763677&doi=10.1016%2fj.jenvman.2018.02.091&partnerID=40&md5=4e9dd92175c8f7c70f8ab67bff0b8a3e","Marine Protected Areas are considered key tools for conservation of coastal ecosystems. However, many reserves are characterized by several problems mainly related to inadequate zonings that often do not protect high biodiversity and propagule supply areas precluding, at the same time, economic important zones for local interests. The Gulf of Naples is here employed as a study area to assess the effects of inclusion of different conservation features and costs in reserve design process. In particular eight scenarios are developed using graph theory to identify propagule source patches and fishing and exploitation activities as costs-in-use for local population. Scenarios elaborated by MARXAN, software commonly used for marine conservation planning, are compared using multivariate analyses (MDS, PERMANOVA and PERMDISP) in order to assess input data having greatest effects on protected areas selection. MARXAN is heuristic software able to give a number of different correct results, all of them near to the best solution. Its outputs show that the most important areas to be protected, in order to ensure long-term habitat life and adequate propagule supply, are mainly located around the Gulf islands. In addition through statistical analyses it allowed us to prove that different choices on conservation features lead to statistically different scenarios. The presence of propagule supply patches forces MARXAN to select almost the same areas to protect decreasingly different MARXAN results and, thus, choices for reserves area selection. The multivariate analyses applied here to marine spatial planning proved to be very helpful allowing to identify i) how different scenario input data affect MARXAN and ii) what features have to be taken into account in study areas characterized by peculiar biological and economic interests. © 2018 Elsevier Ltd","Connectivity analysis; Graph theory; Marine conservation planning; MARXAN; Multivariate analyses","Biodiversity; Conservation of Natural Resources; Costs and Cost Analysis; Ecosystem; Multivariate Analysis; Gulf of Naples; Mediterranean Sea; Tyrrhenian Sea; biodiversity; coastal zone management; connectivity; conservation management; conservation planning; environmental assessment; environmental impact assessment; exploitation; graphical method; marine ecosystem; marine park; multivariate analysis; patch dynamics; propagule; software; spatial planning; Article; clinical assessment; coastal waters; community ecology; conservation biology; controlled study; cost; fishing; marine biology; marine environment; multivariate analysis; nonhuman; population; propagule; software; species habitat; zonation; biodiversity; economics; ecosystem; environmental protection; multivariate analysis","Article","Final","All Open Access; Green Open Access","Scopus","2-s2.0-85042763677"
"Makailipessy M.M.; Thenu I.M.; Abrahamsz J.","Makailipessy, Marvin Mario (57196955832); Thenu, Imanuel Musa (56641707900); Abrahamsz, James (57200543253)","57196955832; 56641707900; 57200543253","Marine spatial utilization by local fisherman in west kei kecil small islands park, maluku province, Indonesia","2018","AACL Bioflux","11","1","","43","54","11","0","","https://www.scopus.com/inward/record.uri?eid=2-s2.0-85041556879&partnerID=40&md5=3eaeaa43c7dfbfcbe20c9c1d7ee8343c","Spatial information on fishing such as fishing grounds of local fishermen contributes to the preparation and evaluation of zoning of a marine conservation area. This information is also useful in reducing the potential for space conflicts. The purpose of this study is to analyze the use of sea space by local fishermen based on fishing gear and fishing ground, as well as evaluation of suitability of fishing ground with zonation system in the conservation area of Kei Kecil Island. The research was conducted in May to August 2017, in 3 fishermen ohoi (village), Matwaer, Somlain and Ohoidertutu. Data collection uses interview techniques and participatory mapping. Data is processed and analyzed based on geographic information system (GIS). The results show the utilization of marine space based on the distribution of fishing gear which is dominated by gill net and lines. The use of marine space based on fishing ground, varies seasonally. Local fishermen categorize seasonally fishing ground based on the distribution of fish catches, include: high season from September to December, middle season from May to August, and low season from January to April. There are three types of fishing ground based on the intensity of space use, covering primary, secondary and tertiary fishing ground. Tertiary fishing grounds have wider space use patterns than other types of fishing ground. In the famine season, fishermen tend to enter core zones, sub-zones of tourism and aquaculture for fishing purposes, means that local fishermen have violated the zonation system on TPK Kei Kecil Island. © 2018, BIOFLUX SRL. All rights reserved.","Evaluation; Fisherman; Fishing ground; Marine protected area; Zonation system","","Article","Final","","Scopus","2-s2.0-85041556879"
"Albano P.G.; D'Occhio P.; Strazzari G.; Succetti F.; Sabelli B.","Albano, Paolo G. (55262664800); D'Occhio, Pamela (56017273000); Strazzari, Grazia (56016417500); Succetti, Fabio (56017142600); Sabelli, Bruno (6602324342)","55262664800; 56017273000; 56016417500; 56017142600; 6602324342","Land-mollusc forest communities along an altitudinal transect in northern Italy","2014","Journal of Molluscan Studies","80","1","","55","61","6","6","10.1093/mollus/eyt041","https://www.scopus.com/inward/record.uri?eid=2-s2.0-84893050884&doi=10.1093%2fmollus%2feyt041&partnerID=40&md5=93d0ca699fab69bc20ac66b7d25c9494","While central and northern European land-mollusc forest communities have received considerable research effort, southern Europe has enjoyed much less attention. Despite the extent of Italian forests in terms of altitude and latitude, there has been only one previous quantitative study of their molluscan faunas. This paper describes the molluscan communities of six forest habitats in northern Italy along an altitudinal transect. Species richness had its highest values at low elevations, especially in maritime woodland and in riverine poplar woodland. Species abundance decreased from lowland to montane habitats, possibly as a consequence of a transition from eutrophic to oligotrophic habitats and from calcareous to acidic soils. Compared with the central and northern European forests, the Italian forests were poorer as far as species richness is concerned, but showed greater diversity among locations as the Jaccard presence/absence similarity index among habitats is equal or lower than 0.5. Considering abundances, all molluscan communities were significantly different in pairwise comparisons, with the single exception of the montane mixed-deciduous and beech forests. The low faunal similarity among sites and the high percentage of species found in only one habitat support the need for a network of diverse protected areas to preserve land-mollusc biodiversity. © 2013 © The Author 2014. Published by Oxford University Press on behalf of The Malacological Society of London, all rights reserved.","","Italy; abundance; acid soil; altitudinal zonation; biodiversity; deciduous forest; forest ecosystem; habitat type; mollusc; protected area; similarity index; species richness; woodland","Article","Final","All Open Access; Bronze Open Access","Scopus","2-s2.0-84893050884"
"Lin J.; Li X.","Lin, Jinyao (55645257300); Li, Xia (34872691500)","55645257300; 34872691500","Conflict resolution in the zoning of eco-protected areas in fast-growing regions based on game theory","2016","Journal of Environmental Management","170","","","177","185","8","38","10.1016/j.jenvman.2015.11.036","https://www.scopus.com/inward/record.uri?eid=2-s2.0-84956661673&doi=10.1016%2fj.jenvman.2015.11.036&partnerID=40&md5=0d5b64b6f210ecbf8e602fb7cf316dac","Zoning eco-protected areas is important for ecological conservation and environmental management. Rapid and continuous urban expansion, however, may exert negative effects on the performance of practical zoning designs. Various methods have been developed for protected area zoning, but most of them failed to consider the conflicts between urban development (for the benefit of land developers) and ecological protection (local government). Some real-world zoning schemes even have to be modified occasionally after the lengthy negotiations between the government and land developers. Therefore, our study has presented a game theory-based method to deal with this problem. Future urban expansion in the study area will be predicted by a logistic regression cellular automaton, while eco-protected areas will be delimitated using multi-objective optimization algorithm. Then, two types of conflicts between them can be resolved based on game theory, a theory of decision-making. We established a two-person dynamic game for each conflict zone. The ecological compensation mechanism was taken into account by simulating the negotiation processes between the government and land developers. A final zoning scheme can be obtained when the two sides reach agreements. The proposed method is applied to the eco-protected area zoning in Guangzhou, a fast-growing city in China. The experiments indicate that the conflicts between eco-protection and urban development will inevitably arise when using only traditional zoning methods. Based on game theory, our method can effectively resolve those conflicts, and can provide a relatively reasonable zoning scheme. This method is expected to support policy-making in environmental management and urban planning. © 2015 Elsevier Ltd.","Cellular automata; Ecological protection; Game theory; Urban expansion; Zoning","Algorithms; China; City Planning; Conservation of Natural Resources; Ecosystem; Game Theory; Humans; Local Government; Negotiating; China; Guangdong; Guangzhou; algorithm; cellular automaton; conflict management; conservation management; decision making; design; environmental management; game theory; local government; optimization; protected area; urban development; zonation; case report; China; city planning; compensation; consensus development; decision making; environmental management; game; government; human; logistic regression analysis; theoretical model; algorithm; city planning; ecosystem; environmental protection; interpersonal communication; procedures","Article","Final","","Scopus","2-s2.0-84956661673"
"Piccoli F.; Burgazzi G.; Laini A.; Ferrari C.; Voccia A.; Filonzi L.; Bolpagni R.; Nonnis Marzano F.","Piccoli, Federica (57189051491); Burgazzi, Gemma (57196440589); Laini, Alex (16175504500); Ferrari, Claudio (57200785989); Voccia, Andrea (57196436601); Filonzi, Laura (23987187200); Bolpagni, Rossano (16303194200); Nonnis Marzano, Francesco (7005637770)","57189051491; 57196440589; 16175504500; 57200785989; 57196436601; 23987187200; 16303194200; 7005637770","Barbel species arrangement in a regional natura 2000 network (Emilia Romagna, Northern Italy): An altitudinal perspective","2017","Journal of Limnology","76","S1","","140","147","7","7","10.4081/jlimnol.2017.1693","https://www.scopus.com/inward/record.uri?eid=2-s2.0-85033220369&doi=10.4081%2fjlimnol.2017.1693&partnerID=40&md5=73a2e8d4cffcfcd5cb90a7aa279152fe","Southern Europe hosts a large number of critical catchments for freshwater biodiversity, including endemic fish species. Unfortunately, these areas are severely threatened due to direct and indirect anthropogenic effects. In this context, with the aim to improve the effectiveness of threatened fish protection, the Life project BARBIE (LIFE13 NAT/IT/001129) started in 2014 and focused on three congeneric species of the genus Barbus: two of “priority interest” sensu Habitats Directive [Barbus caninus (Bonaparte, 1839), and B. plebejus (Bonaparte, 1839)], and one alien [Barbus barbus (Linnaeus, 1758)]. Our main objective was to assess the contribution of a complex of protected areas included in the Natura 2000 network - located in the provinces of Parma, Piacenza and Reggio Emilia (Norther Italy) - to support the presence of the three barbel species in analysis. Additionally, we explored the role of a set of environmental variables (i.e., physical, chemical, biological, and land-use descriptors) to drive the current conditions of the study sites and the responses of Barbus species. As a general rule, the present study confirmed a clear decline of the local native barbel populations, and confirmed the existence of a zonation pattern of the barbel taxa. Hence, we observed a strong altitude segregation between native vs. alien species, with the exotic B. barbus currently limited to plain and only sporadically present in the Apennine areas as genetic introgression. These evidences mirrored the altitudinal gradients of anthropogenic disturbance. The main causes were the progressive disappearance of well-structured riparian stripes, and the intense land use change, ranging from semi-natural patches (mountain and hill sectors) to land clearing for intensive agriculture (lowland sectors). This highlights the need to take into account the spatial dynamics of alien invasive species in programming recovery actions that could have unexpected impacts to the native fish populations, for example the reduction of the hydraulic fragmentation along rivers. © 2017, Page Press Publications. All rights reserved.","Barbus genus species; Endangered fish; Fluvial Functionality Index; Habitats Directive; Inland waters; Physical and chemical drivers","Emilia-Romagna; Italy; Parma [Emilia-Romagna]; Piacenza; Reggio Emilia; Barbus; Barbus barbus; Barbus caninus; Barbus plebejus; Emilia; anthropogenic effect; biodiversity; disturbance; endangered species; endemic species; fish; freshwater; protected area","Article","Final","All Open Access; Gold Open Access; Green Open Access","Scopus","2-s2.0-85033220369"
"Dorji S.; Rajaratnam R.; Falconi L.; Williams S.E.; Sinha P.; Vernes K.","Dorji, Sangay (54386722300); Rajaratnam, Rajanathan (16029386000); Falconi, Lorena (55580582000); Williams, Stephen E. (7404834819); Sinha, Priyakant (55066418000); Vernes, Karl (6701743827)","54386722300; 16029386000; 55580582000; 7404834819; 55066418000; 6701743827","Identifying conservation priorities for threatened Eastern Himalayan mammals","2018","Conservation Biology","32","5","","1162","1173","11","14","10.1111/cobi.13115","https://www.scopus.com/inward/record.uri?eid=2-s2.0-85052458151&doi=10.1111%2fcobi.13115&partnerID=40&md5=bf752043d3f31b32b3351431b1ebc525","To augment mammal conservation in the Eastern Himalayan region, we assessed the resident 255 terrestrial mammal species and identified the 50 most threatened species based on conservation status, endemism, range size, and evolutionary distinctiveness. By using the spatial analysis package letsR and the complementarity core-area method in the conservation planning software Zonation, we assessed the current efficacy of their protection and identified priority conservation areas by comparing protected areas (PAs), land cover, and global ecoregion 2017 maps at a 100 × 100 m spatial scale. The 50 species that were most threatened, geographically restricted, and evolutionarily distinct faced a greater extinction risk than globally nonthreatened and wide-ranging species and species with several close relatives. Small, medium-sized, and data-deficient species faced extinction from inadequate protection in PAs relative to wide-ranging charismatic species. There was a mismatch between current PA distribution and priority areas for conservation of the 50 most endangered species. To protect these species, the skewed regional PA distribution would require expansion. Where possible, new PAs and transboundary reserves in the 35 priority areas we identified should be established. There are adequate remaining natural areas in which to expand current Eastern Himalayan PAs. Consolidation and expansion of PAs in the EH requires strengthening national and regional transboundary collaboration, formulating comprehensive regional land-use plans, diversifying conservation funding, and enhancing information sharing through a consolidated regional database. © 2018 Society for Conservation Biology","data deficient; deficiente de datos; evolutionarily distinct mammal; extinción; extinction; half-earth; mamífero pequeñom mamífero evolutivamente distintivo; media tierra; protected area; small mammal; Zonation; Zonation; área protegida","Animals; Biodiversity; Conservation of Natural Resources; Endangered Species; Mammals; Spatial Analysis; Himalayas; Mammalia; complementarity; conservation management; conservation planning; ecoregion; endangered species; extinction risk; identification method; land cover; protected area; small mammal; species conservation; terrestrial ecosystem; zonation; animal; biodiversity; endangered species; environmental protection; mammal; spatial analysis","Article","Final","","Scopus","2-s2.0-85052458151"
"Virtanen E.A.; Viitasalo M.; Lappalainen J.; Moilanen A.","Virtanen, Elina A. (57200912983); Viitasalo, Markku (7006328418); Lappalainen, Juho (56888862300); Moilanen, Atte (57200306804)","57200912983; 7006328418; 56888862300; 57200306804","Evaluation, gap analysis, and potential expansion of the Finnish Marine Protected Area network","2018","Frontiers in Marine Science","9","NOV","402","","","","34","10.3389/fmars.2018.00402","https://www.scopus.com/inward/record.uri?eid=2-s2.0-85056108981&doi=10.3389%2ffmars.2018.00402&partnerID=40&md5=063922539675973331086fb067f83177","Marine Protected Areas (MPAs) are essential for safeguarding marine biodiversity. Various international and regional agreements require that nations designate sufficient marine areas under protection. Assessing the functionality and coherence of MPA networks is challenging, unless extensive data on species and habitats is available. We evaluated the efficiency of the Finnish MPA network by utilizing a unique dataset of ~140,000 samples, recently collected by the Finnish Inventory Programme for the Underwater Marine Environment, VELMU. Using the quantitative conservation planning and the spatial prioritization method Zonation, we identified sites of high biodiversity and developed a balanced ranking of marine conservation values. Only 27% of the ecologically most valuable features were covered by the current MPA network. Based on the analyses, a set of expansion sites were identified that efficiently complement the ecological and geographical gaps in the current MPA network. Increasing protected sea area by just one percent point, would double the mean conservation cover, and specifically increase the protection levels of habitat types based on IUCN Red List of Ecosystems, key species, threatened species and fish reproduction areas. We also discovered that a large part of ecologically valuable species, such as many brown and red algae, blue mussels and eelgrass, exist in the underwater parts of rocky islands and sandy shores. These areas do not belong to the present (Finnish) interpretation of the habitats (e.g., reefs and underwater sandbanks) listed in the EU Habitats Directive. Neglecting these environments may lead to lack of protection of functionally important biodiversity. We emphasize that, in addition to establishing MPAs, also ecosystem-based marine spatial planning is needed to safeguard the integrity of marine biodiversity in the northern Baltic Sea. The spatial prioritization maps produced in this study are essentially environmental value maps which can also be used in impact avoidance, such as siting of wind energy and aquaculture, or in avoiding overfishing in the most valuable fish areas. Our approach and analytical procedure can be replicated in the Baltic Sea or elsewhere provided that sufficient data exist. © 2018 Virtanen, Viitasalo, Lappalainen and Moilanen.","Baltic Sea; Boosted regression trees; Conservation planning; Marine spatial planning; Spatial conservation prioritization; Species distribution modeling; Zonation software","","Article","Final","All Open Access; Gold Open Access; Green Open Access","Scopus","2-s2.0-85056108981"
"Boulaaba S.; Zrelli S.; Płóciennik M.; Boumaiza M.","Boulaaba, S. (56418454400); Zrelli, S. (37109059100); Płóciennik, M. (26538078300); Boumaiza, M. (6602598872)","56418454400; 37109059100; 26538078300; 6602598872","Diversity and distribution of Chironomidae (Insecta: Diptera) of protected areas in North Tunisia; [Diversité et distribution des Chironomidae (Insecta, Diptera) au Nord de la Tunisie]","2014","Knowledge and Management of Aquatic Ecosystems","","415","A6","","","","6","10.1051/kmae/2014031","https://www.scopus.com/inward/record.uri?eid=2-s2.0-84910610381&doi=10.1051%2fkmae%2f2014031&partnerID=40&md5=05e0874ad0d8996196e84cd5ba3caf50","In North Africa seasonal streams called wadi are an unique habitats with serve hydrological and thermal regime. Non-biting midges take an important part of freshwater biodiversity in North Africa. We present new data on the distribution and diversity of Chironomidae in North Tunisia. Larvae, pupal exuviae and adult males of chironomids were collected from a various freshwater ecosystems from May 2005 till April 2006. The aim of this study was to recognize the pattern of midge diversity in North Tunisia to estimate ecological value of running waters in the region. In total, 79 taxa were identified. Nearly all of the taxa were typical representatives of the Palaearctic and Mediterranean complexes. The majority of the investigated sites belonged to the protected areas in North Tunisia, such as the Ichkeul National Park, the Kroumerie Mountains and the El Feija National Park, part of the Intercontinental Reserve of the Mediterranean Biosphere. Altitudinal zonation of the communities composition was found in the lowland (<250 m a.s.l.) and upland zone (>250 m a.s.l.) with maximum of 760 m. Whereas among the data 39 species are recorded from Tunisia for the first time, the species richness of Chironomidae is higher than previously estimated. © 2014 ONEMA.","Biodiversity; Chironomidae; Diptera; Tunisia; Wadi","Ceratopogonidae; Chironomidae; Diptera; Insecta","Article","Final","All Open Access; Gold Open Access; Green Open Access","Scopus","2-s2.0-84910610381"
